{
  "schema_version": 1,
  "model_key": "anenji_anj_6200_48pl",
  "manufacturer": "Anenji",
  "model": "ANJ-6200-48PL",
  "aliases": [],
  "lifecycle": "supported",
  "variants": [
    {
      "variant_key": "layout2_model8960",
      "label": "Known SMG layout 2 variant",
      "device_descriptor_keys": [
        "anenji_anj_6200_48pl"
      ],
      "known_firmware": []
    }
  ],
  "validation": {
    "hardware": "captured",
    "telemetry": "confirmed",
    "controls": "partial"
  },
  "coverage": {
    "runtime_control_surface": "available",
    "smartess_control_surface": "unknown",
    "vendor_register_map": "documented",
    "notes": [
      "Uses a model-specific output-priority enum at register 301. SUB/SBU were observed working; SUF/ZEC writes remain unverified and the selector requires Full Control. Other existing controls are unchanged."
    ]
  },
  "known_limitations": [
    "SUF permits grid export. ZEC requires external CT configuration. Correct mode names do not remove inverter-side write restrictions.",
    "The remaining historical SMG 6200 controls are not all independently hardware-confirmed on this unit."
  ],
  "knowledge_summary": "Exact layout 2/model 0x2300 with a dedicated SUB/SBU/SUF/ZEC output-priority table; remaining historical telemetry and controls are preserved.",
  "source_keys": [
    "documentation_classic_smg_rs232_v1",
    "documentation_gm6200_protocol_2",
    "github_issue_8",
    "github_issue_51",
    "support_archive_anj6200_48pl"
  ]
}
