{
  "schema_version": 1,
  "model_key": "sandisolar_sd_11kp48v_wifi",
  "manufacturer": "Sandisolar",
  "model": "SD 11KP48V WIFI",
  "aliases": [],
  "lifecycle": "experimental",
  "variants": [
    {
      "variant_key": "layout4_model32771",
      "label": "Protocol-4 fingerprint 171=0x8003, 184=4",
      "device_descriptor_keys": [
        "sandisolar_sd_11kp48v"
      ],
      "known_firmware": []
    }
  ],
  "validation": {
    "hardware": "captured",
    "telemetry": "partial",
    "controls": "partial"
  },
  "coverage": {
    "runtime_control_surface": "available",
    "smartess_control_surface": "unknown",
    "vendor_register_map": "documented",
    "notes": [
      "The exact layout/model fingerprint is captured from the issue #13 beta.4 support archive.",
      "Telemetry uses the documented protocol-4 projection; this prevents generic SMG interpretation of register 227 as temperature.",
      "Canonical Grid and inverter power values use the protocol-4 L1 points. Legacy total fields remain available in support captures instead of acting as value-based fallbacks.",
      "Secondary Charging Priority and Secondary Output Priority are hardware-confirmed on this exact fingerprint.",
      "The remaining compatible ANJ write surface is inherited only as untested Full-Control candidates."
    ]
  },
  "known_limitations": [
    "Only Secondary Charging Priority and Secondary Output Priority have been hardware-validated; every other inherited control remains Full-Control-only until hardware retesting."
  ],
  "knowledge_summary": "Sandisolar SD 11KP48V WIFI with exact layout-4/model-0x8003 identity. Captured telemetry and protocol documentation select the shared protocol-4 projection, while compatible write candidates remain explicitly untested.",
  "source_keys": [
    "github_issue_13_sandisolar_sd_11kp48v_beta4",
    "github_issue_13_sandisolar_grid_power_20260829",
    "github_issue_13_sandisolar_secondary_controls_20260827",
    "documentation_anenji_protocol_3_10",
    "third_party_easun_smg_ii_11kw_register_map"
  ]
}
