{
  "schema_version": 1,
  "model_key": "anenji_ges48120m250_500p",
  "manufacturer": "Anenji",
  "model": "GES48120M250-500P",
  "aliases": ["Anenji white 12kW split-phase"],
  "lifecycle": "experimental",
  "variants": [
    {
      "variant_key": "sumry_ges_7530",
      "label": "Sumry/GES 0x7530 map, model 45 / class 10 / protocol 220",
      "device_descriptor_keys": ["anenji_ges48120m250_500p"],
      "known_firmware": ["protocol raw 220 (0x00DC at 0xC768)"]
    }
  ],
  "validation": {
    "hardware": "captured",
    "telemetry": "partial",
    "controls": "none"
  },
  "coverage": {
    "runtime_control_surface": "none",
    "smartess_control_surface": "unknown",
    "vendor_register_map": "partial",
    "notes": [
      "Runtime binding requires three exact FC03 identity anchors on holding registers 0xC738-0xC739 and 0xC768: model code 45, product class 10, protocol version raw 220.",
      "The bound read-only surface exposes nine phase-A and battery measurements from 0x7530, 0x7548 and 0x756A only; no derived power totals or write profile.",
      "CRC-valid owner captures corroborate battery and phase-A output/mains voltage, current and frequency in the community-hosted V2.6.3 PDF."
    ]
  },
  "known_limitations": [
    "Split-phase second leg, PV, CT-only grid semantics, temperatures and active-power registers are not part of this read-only subset.",
    "Product class 10 is required for this entry; other PDF enum values must not select this descriptor.",
    "The protocol PDF is community-hosted, not independently authenticated supplier documentation.",
    "No controls or write profiles are exposed."
  ],
  "knowledge_summary": "Anenji GES48120M250-500P answers the Sumry/GES-style high-address holding map at 0x7530, not the low-address SMG map. Owner FC03 captures establish model 45, product class 10 and protocol 220 together with corroborated battery and phase-A telemetry. The integration exposes a small read-only runtime surface gated on all three identity anchors.",
  "source_keys": [
    "issue_49_ges_7530_read_evidence",
    "issue_49_ges_identity_capture",
    "community_ges_modbus_v263"
  ]
}
