{
  "schema_version": 1,
  "model_key": "yingfa_yf6_2k_2k_lel_if",
  "manufacturer": "Yingfa",
  "model": "YF6.2K-2K-LEL-IF",
  "aliases": [
    "YF6.2K"
  ],
  "lifecycle": "research",
  "variants": [
    {
      "variant_key": "unidentified",
      "label": "Protocol and runtime mapping not yet confirmed",
      "device_descriptor_keys": []
    }
  ],
  "validation": {
    "hardware": "reported",
    "telemetry": "unknown",
    "controls": "none"
  },
  "coverage": {
    "runtime_control_surface": "none",
    "smartess_control_surface": "unknown",
    "vendor_register_map": "unknown",
    "notes": [
      "The earlier PI30 capture was attributed to this model in error. The owner clarified that the captured devices were Sumry inverters, not this Yingfa."
    ]
  },
  "known_limitations": [
    "No confirmed inverter protocol or runtime mapping is available for this particular model.",
    "Working collector discovery or a UDP callback acknowledgement does not establish inverter compatibility."
  ],
  "knowledge_summary": "The issue #6 owner reports a Yingfa YF6.2K-2K-LEL-IF, but its inverter protocol remains unresolved. Previously linked PI30 evidence belongs to Sumry devices and is not proof of support for this Yingfa. This correction does not remove generic PI30 support or evidence for other independently reported Yingfa models.",
  "source_keys": [
    "github_issue_6",
    "issue_6_device_attribution_correction"
  ]
}
