{
  "schema_version": 1,
  "model_key": "eybond_short_ascii_family",
  "manufacturer": "EyeBond",
  "model": "Short-ASCII family",
  "aliases": [
    "EyeBond Short-ASCII family"
  ],
  "lifecycle": "experimental",
  "variants": [
    {
      "variant_key": "urtu1920_checksum",
      "label": "EyeBond Short-ASCII read-only family (URTU1920 checksum dialect)",
      "device_descriptor_keys": [
        "eybond_short_ascii_family"
      ],
      "known_firmware": []
    }
  ],
  "validation": {
    "hardware": "captured",
    "telemetry": "partial",
    "controls": "none"
  },
  "coverage": {
    "runtime_control_surface": "read_only",
    "smartess_control_surface": "not_applicable",
    "vendor_register_map": "partial",
    "notes": [
      "Runtime support is family-only and read-only. Compatible devices appear as EyeBond Short-ASCII family; retail model and serial are not inferred.",
      "Optional RB/F/RH and aux-0200 MPPT/PV entities are disabled by default and expire on TTL or invalid replies."
    ]
  },
  "known_limitations": [
    "Family identity only: no retail commercial model (including no Anern SPI-12000W claim) and no inverter serial from MP/Q1/MD.",
    "Read-only: no inverter controls; Full Control does not invent settings.",
    "Optional live PV/MPPT uses the documented auxiliary 0200 runtime read only (not tip AABB harvest, not settings 0202). Matching schema sensors stay disabled by default; mppt_error_code is diagnostic and quiet. Samples use 30 s solicit / 60 s TTL; at most one optional read per Q1 cycle, with FC4 RB/F/RH preferred when both are due.",
    "Offline decode_short_ascii_mppt is a maintainer capture inspector only; it is not the live optional admission path and does not create entities by itself.",
    "Live PV/MPPT admission is code-complete but not yet live-qualified on site HA (family cutover / Support Archive RECEIPT still pending).",
    "Quiet fault/diagnostic sensors beyond Q1 flags and the quiet mppt_error_code (Q2 extras) remain deferred.",
    "estimated_ac_load_power is load% × rated VA from F — an estimate, not measured active power; load_percent stays separate. Output frequency is not grid frequency.",
    "Optional BMS currents and battery_power publish only when RH reports BMS current display accuracy=1 (decimals) and F ratings are available for I/P hard-reject bounds; RH=0, unread, expired or failed RH omits those keys. RH=1 is the discriminator (no retail-model gate).",
    "Impossible RB V/SoC/I/P values are hard-rejected. Link-loss (V=0 ∧ SoC=0) may hold last-good BMS for up to 180 s without refreshing sample age; normal RB TTL remains 60 s.",
    "Diagnostic counters: bms_link_loss_count and rb_hard_reject_count are runtime-scoped; reading_hold_pending_count stays 0 (physics confirmation-hold deferred).",
    "BMS current / battery_power path is SmartValue-correlated on one live family member; other members (e.g. Maxinn) are not separately live-proven and only light up if RH=1."
  ],
  "knowledge_summary": "EyeBond Short-ASCII is a capture-qualified read-only family for the fixed MP/Q1/MD dialect shared by some Anern and Maxinn sites. Optional F/RH/RB add rated values and BMS telemetry with TTL expiry, hard-reject/link-loss hold, and an RH+F gate for currents. Optional live PV/MPPT uses aux 0200 with opt-in entities and TTL; offline MPPT decode stays maintainer-only. Labelled AC-load estimate is separate from measured battery DC power. Retail-model identity remains out of scope; site live-qualification for the PV path is still pending.",
  "source_keys": [
    "documentation_vendor_19b4_urtu1920_short_ascii",
    "support_archive_short_ascii_family_anern_maxinn"
  ]
}
