{
  "schema_version": 1,
  "model_key": "anenji_anj_11kw_48v_wifi_p",
  "manufacturer": "Anenji",
  "model": "ANJ-11KW-48V-WIFI-P",
  "aliases": [],
  "lifecycle": "supported",
  "variants": [
    {
      "variant_key": "layout4_model32768",
      "label": "Anenji 11kW variant",
      "device_descriptor_keys": [
        "anenji_anj_11kw"
      ],
      "known_firmware": []
    }
  ],
  "validation": {
    "hardware": "captured",
    "telemetry": "confirmed",
    "controls": "confirmed"
  },
  "coverage": {
    "runtime_control_surface": "hardware_confirmed",
    "smartess_control_surface": "unknown",
    "vendor_register_map": "documented",
    "notes": [
      "Device-specific runtime profile is user-confirmed.",
      "Communication Protocol No. 3-10 documentation defines the protocol-4 telemetry projection used by this model.",
      "Register 602 secondary-output priority is documented and hardware-read-correlated; local write behavior remains conditional pending a device retest."
    ]
  },
  "known_limitations": [
    "Secondary Output Priority writes are available only in Full Control until register 602 is write-tested on hardware."
  ],
  "knowledge_summary": "Anenji 11kW unit with a model-specific control profile over the shared protocol-4 register projection, backed by donor captures, user-confirmed controls, and the Protocol No. 3-10 documentation.",
  "source_keys": [
    "corpus_anenji_anj_11kw",
    "private_message_anenji_anj_11kw_validation",
    "documentation_anenji_protocol_3_10",
    "support_archive_anenji_anj_11kw_secondary_controls_20260707"
  ]
}
